city_id,city_name,country,description
258,Honiara,Solomon Islands,"Lush tropical landscapes meet vibrant local markets, offering an authentic and immersive experience in a laid-back island atmosphere.| Region: oceania|Budget: Mid-range"
259,Siena,Italy,"Medieval streets wind through sunlit squares, where the aroma of fresh pasta mingles with the echoes of vibrant local life.| Region: europe|Budget: Mid-range"
260,La Palma,Spain,"Lush landscapes and volcanic vistas create a serene atmosphere, inviting you to explore its quiet trails and charming coastal villages.| Region: europe|Budget: Mid-range"
261,Ghent,Belgium,"Charming canals and medieval architecture create a cozy atmosphere, inviting you to wander through cobblestone streets and discover hidden corners filled with history.| Region: europe|Budget: Mid-range"
262,Sao Paulo,Brazil,"Energetic streets buzz with life, offering a tapestry of art, diverse cuisine, and vibrant nightlife that captivates every sense.| Region: south_america|Budget: Mid-range"
263,Monteverde,Costa Rica,"Misty cloud forests and vibrant wildlife create an enchanting atmosphere, where every trail offers a new sensory delight and adventure.| Region: north_america|Budget: Mid-range"
264,Nukuʻalofa,Tonga,"Warm ocean breezes and vibrant markets create a welcoming atmosphere, where the gentle rhythm of island life invites endless exploration.| Region: oceania|Budget: Mid-range"
265,Birmingham,United Kingdom,"A dynamic mix of industrial charm and modern culture, offering vibrant markets, eclectic eateries, and a rich musical heritage that captivates visitors.| Region: europe|Budget: Mid-range"
266,Tuscany,Italy,"Rolling hills, sun-drenched vineyards, and charming medieval towns create a picturesque landscape that invites leisurely exploration and indulgent culinary experiences.| Region: europe|Budget: Mid-range"
267,Charlottetown,Canada,Charming streets lined with historic buildings and a gentle sea breeze create a welcoming atmosphere perfect for leisurely exploration and relaxation.| Region: north_america|Budget: Mid-range
268,St. Louis,United States,"A fusion of historic charm and modern vibrancy, with leafy parks, jazz-filled streets, and the iconic arch creating a welcoming urban atmosphere.| Region: north_america|Budget: Mid-range"
269,Las Vegas,United States,"Bright lights and endless energy create an exhilarating atmosphere, where entertainment options are as vast and varied as the desert surrounding it.| Region: north_america|Budget: Luxury"
270,Detroit,United States,"Industrial charm meets vibrant arts and music scenes, where historic architecture and modern innovation create a dynamic and inviting urban experience.| Region: north_america|Budget: Mid-range"
271,Suzhou,China,"Serene gardens, ancient canals, and the gentle rustle of willow trees create a peaceful escape that invites you to slow down and unwind.| Region: asia|Budget: Mid-range"
272,Sardinia,Italy,"Crystal-clear waters, rugged coastlines, and charming villages create a serene escape where you can unwind and savor local flavors.| Region: europe|Budget: Mid-range"
273,Port Vila,Vanuatu,"Lush greenery meets turquoise waters, where vibrant markets and friendly locals create a warm, inviting atmosphere amidst tropical island breezes.| Region: oceania|Budget: Mid-range"
275,Luxor,Egypt,"Sun-drenched landscapes and ancient temples create an awe-inspiring atmosphere, where history feels alive amid the vibrant local culture and bustling markets.| Region: africa|Budget: Budget"
276,Providenciales,Turks and Caicos,"Crystal-clear turquoise waters, powdery white sand beaches, and a laid-back island vibe create a serene paradise perfect for unwinding and rejuvenating.| Region: north_america|Budget: Luxury"
277,Siwa Oasis,Egypt,"Wandering through sun-drenched palm groves and ancient ruins, you feel the timeless tranquility and unique charm of this remote desert haven.| Region: africa|Budget: Budget"
278,Mombasa,Kenya,"Lively markets, stunning beaches, and a fusion of cultures create a vibrant atmosphere where you can feel the ocean breeze and hear Swahili melodies.| Region: africa|Budget: Mid-range"
279,Dushanbe,Tajikistan,"Tree-lined avenues and Soviet-era architecture blend with bustling bazaars, creating a unique atmosphere where tradition and modernity coexist harmoniously.| Region: asia|Budget: Budget"
280,Cuzco,Peru,"Cobblestone streets, vibrant markets, and the scent of fresh Andean cuisine surround you in a city where ancient history meets lively modern culture.| Region: south_america|Budget: Budget"
281,Nara,Japan,"Ancient temples, serene deer-filled parks, and tranquil gardens offer a peaceful escape, inviting you to wander and reflect in harmony with nature.| Region: asia|Budget: Mid-range"
282,Buenos Aires,Argentina,"Lively streets filled with tango rhythms, vibrant markets, and historic architecture create an irresistible blend of culture and energy.| Region: south_america|Budget: Mid-range"
283,Córdoba,Argentina,"Historic streets buzz with student energy, colonial architecture, and a lively arts scene, offering a vibrant mix of tradition and modernity.| Region: south_america|Budget: Mid-range"
284,Sydney,Australia,"A lively harbor city where golden beaches meet urban sophistication, offering a blend of vibrant culture and stunning natural beauty.| Region: oceania|Budget: Luxury"
285,Hualien,Taiwan,"Nestled between lush mountains and the Pacific Ocean, this place offers stunning landscapes, tranquil vibes, and a welcoming local culture.| Region: asia|Budget: Mid-range"
286,Vienna,Austria,"Grand architecture and cobblestone streets set a charming backdrop for cozy coffeehouses and vibrant cultural scenes, inviting leisurely exploration.| Region: europe|Budget: Mid-range"
287,Baku,Azerbaijan,"A city where futuristic architecture meets ancient history, offering a unique blend of modernity and tradition with a lively, welcoming atmosphere.| Region: asia|Budget: Mid-range"
288,Minsk,Belarus,"Wide boulevards and Soviet-era architecture mix with vibrant cafes and green parks, offering a unique blend of history and modern charm.| Region: europe|Budget: Budget"
289,Santa Cruz,Bolivia,"Vibrant streets buzz with the energy of lively markets and the aroma of street food, set against a backdrop of lush green parks.| Region: south_america|Budget: Budget"
290,Mostar,Bosnia and Herzegovina,"Cobblestone streets, the sound of the river below, and the iconic bridge create a charming and reflective atmosphere in this historic town.| Region: europe|Budget: Budget"
291,Salvador da Bahia,Brazil,"Lively streets filled with music and dance, vibrant markets, and stunning coastal views create an energetic yet laid-back atmosphere.| Region: south_america|Budget: Mid-range"
292,Bujumbura,Burundi,"A city where vibrant street markets and lush lakeside views create an inviting atmosphere, full of lively interactions and serene moments.| Region: africa|Budget: Budget"
293,Yaoundé,Cameroon,Lush greenery and vibrant markets create a lively atmosphere filled with the scent of street food and the rhythm of local music.| Region: africa|Budget: Budget
294,Galway,Ireland,Charming cobblestone streets and vibrant pubs filled with music create an inviting atmosphere where the warmth of the locals is unforgettable.| Region: europe|Budget: Mid-range
295,Calgary,Canada,"A dynamic blend of urban sophistication and stunning natural landscapes, where vibrant arts scenes meet the majestic Rockies under vast blue skies.| Region: north_america|Budget: Mid-range"
296,Halifax,Canada,"Charming coastal vibes blend with historic architecture, lively pubs, and the salty breeze, creating an inviting and laid-back maritime atmosphere.| Region: north_america|Budget: Mid-range"
297,Sal,Cape Verde,"Golden beaches meet turquoise waters under a sun that never seems to set, creating a laid-back vibe perfect for unwinding.| Region: africa|Budget: Mid-range"
298,Bath,United Kingdom,"Charming cobblestone streets, historic architecture, and the soothing warmth of natural hot springs create a serene and inviting experience.| Region: europe|Budget: Mid-range"
299,Pristina,Kosovo,"A city where vibrant street life, intriguing history, and the aroma of freshly brewed coffee blend into a unique and welcoming atmosphere.| Region: europe|Budget: Budget"
300,Belgrade,Serbia,"Lively streets filled with eclectic architecture, vibrant nightlife, and a fusion of Eastern and Western influences create an inviting, energetic atmosphere.| Region: europe|Budget: Budget"
301,Dallas,United States,"A lively mix of modern skyscrapers and historic districts, this city offers a dynamic atmosphere with vibrant arts, cuisine, and culture.| Region: north_america|Budget: Mid-range"
302,Guilin,China,"Lush karst mountains rise dramatically above serene rivers and rice paddies, offering a tranquil escape with breathtaking natural beauty at every turn.| Region: asia|Budget: Budget"
303,Hallstatt,Austria,"Nestled by a serene lake, this picturesque village enchants with its cobblestone streets, alpine views, and a tranquil, timeless atmosphere.| Region: europe|Budget: Mid-range"
304,Nicosia,Cyprus,"Wander through leafy streets where ancient history meets modern life, with a vibrant café culture and a warm, welcoming atmosphere.| Region: europe|Budget: Mid-range"
305,San José,Costa Rica,Bustling streets filled with vibrant markets and lush parks create an inviting mix of urban energy and natural beauty.| Region: north_america|Budget: Mid-range
306,Havana,Cuba,"Colorful streets alive with the rhythm of salsa, vintage cars cruising past, and the scent of cigars create an unforgettable atmosphere.| Region: north_america|Budget: Budget"
307,Roseau,Dominica,"Lush greenery envelops vibrant markets and colorful architecture, creating a lively and welcoming atmosphere infused with the scent of tropical blooms.| Region: north_america|Budget: Budget"
308,Carcassonne,France,"Strolling through cobbled streets surrounded by medieval walls, you feel transported to another era, with vibrant markets and cozy restaurants at every turn.| Region: europe|Budget: Mid-range"
309,Lagos,Portugal,"Charming cobblestone streets lead to golden beaches and dramatic cliffs, where the ocean breeze mingles with the aroma of grilled seafood.| Region: europe|Budget: Mid-range"
310,Alexandria,Egypt,"Bustling streets filled with the aroma of spices, historic sites whispering ancient tales, and a vibrant coastal vibe create a unique charm.| Region: africa|Budget: Budget"
311,Tallinn,Estonia,"Medieval lanes, vibrant markets, and the scent of fresh pastries create an enchanting atmosphere that''s both historic and inviting.| Region: europe|Budget: Mid-range"
312,Paris,France,Charming streets lined with artful boutiques and the aroma of freshly baked pastries create a romantic and timeless atmosphere.| Region: europe|Budget: Luxury
313,Puglia,Italy,"Sun-drenched coastlines, charming whitewashed villages, and the aroma of olive groves create a serene and inviting atmosphere.| Region: europe|Budget: Mid-range"
314,Queenstown,New Zealand,"Surrounded by majestic mountains and shimmering lakes, this place offers thrilling adventures and serene landscapes that captivate your senses.| Region: oceania|Budget: Luxury"
315,Biarritz,France,"Ocean breezes mix with the scent of fresh pastries, while sunlit beaches and elegant architecture create a laid-back yet sophisticated vibe.| Region: europe|Budget: Mid-range"
316,Libreville,Gabon,"Lush greenery mingles with urban life, offering a unique blend of vibrant markets, diverse wildlife, and a laid-back coastal vibe.| Region: africa|Budget: Mid-range"
317,Sintra,Portugal,"Misty mornings reveal enchanting palaces and lush gardens, offering a fairytale-like atmosphere that captivates and inspires wanderlust.| Region: europe|Budget: Mid-range"
318,Hvar,Croatia,"Sun-drenched beaches, fragrant lavender fields, and lively waterfronts create a vibrant yet relaxed atmosphere perfect for unwinding and exploring.| Region: europe|Budget: Mid-range"
319,Rostock,Germany,"Charming cobblestone streets and historic architecture meet the refreshing sea breeze, creating a welcoming blend of maritime history and modern vibrancy.| Region: europe|Budget: Mid-range"
320,Zakynthos,Greece,"Golden sandy beaches, crystal-clear waters, and charming villages create a serene and inviting atmosphere perfect for relaxation and exploration.| Region: europe|Budget: Mid-range"
321,Reykjavík,Iceland,"A city where modern design meets dramatic landscapes, offering cozy cafes, vibrant street art, and the ethereal glow of the northern lights.| Region: europe|Budget: Luxury"
322,Jodhpur,India,"Sun-drenched streets weave through vibrant markets and historic forts, offering a sensory journey rich with colors, aromas, and cultural warmth.| Region: asia|Budget: Budget"
323,Bandung,Indonesia,"Cool mountain air, vibrant street markets, and a mix of colonial architecture create a refreshing escape with a laid-back yet lively vibe.| Region: asia|Budget: Budget"
324,Naples,Italy,"Bustling streets filled with the aroma of pizza, vibrant street life, and historic architecture create a lively and authentic Italian experience.| Region: europe|Budget: Mid-range"
325,Yamoussoukro,Ivory Coast,"Wide avenues lined with palm trees lead to the awe-inspiring basilica, while the tranquil surroundings invite a leisurely exploration of local culture.| Region: africa|Budget: Budget"
326,Sapporo,Japan,"Snow-dusted streets, lively markets, and the aroma of fresh seafood create a vibrant yet cozy atmosphere that''s both inviting and invigorating.| Region: asia|Budget: Mid-range"
327,Almaty,Kazakhstan,"Nestled beneath snow-capped mountains, the city offers a blend of Soviet-era charm and vibrant modern culture, with bustling markets and serene parks.| Region: asia|Budget: Mid-range"
328,Luxembourg City,Luxembourg,"Charming cobblestone streets wind through lush valleys and historic fortresses, creating a serene yet vibrant atmosphere that''s both inviting and intriguing.| Region: europe|Budget: Luxury"
329,San Cristóbal de las Casas,Mexico,"Charming cobblestone streets, vibrant markets, and colorful colonial architecture create a warm and inviting atmosphere, perfect for leisurely exploration.| Region: north_america|Budget: Budget"
330,Riga,Latvia,"Charming cobblestone streets, vibrant markets, and a blend of medieval and Art Nouveau architecture create a captivating and cozy atmosphere for exploration.| Region: europe|Budget: Mid-range"
331,Portland,United States,"Quirky neighborhoods, lush green parks, and a thriving food scene create an inviting atmosphere filled with creativity and a laid-back vibe.| Region: north_america|Budget: Mid-range"
332,Ulaanbaatar,Mongolia,"Amidst sprawling landscapes, discover a blend of Soviet-era architecture, bustling markets, and the warm hospitality of locals eager to share their stories.| Region: asia|Budget: Budget"
333,Essaouira,Morocco,"Charming coastal breezes mix with the vibrant hum of bustling souks and the scent of fresh seafood, creating a laid-back, inviting atmosphere.| Region: africa|Budget: Budget"
334,Pokhara,Nepal,"Nestled by a serene lake and surrounded by lush hills, this place offers tranquility and adventure, with stunning mountain views at every turn.| Region: asia|Budget: Budget"
335,Eindhoven,Netherlands,"Innovative design and vibrant street art create a lively atmosphere, while cozy cafes and green spaces offer moments of relaxation and inspiration.| Region: europe|Budget: Mid-range"
336,Port Moresby,Papua New Guinea,"A bustling city where the vibrant markets and lush coastal landscapes blend with the rich cultural tapestry, offering a unique sensory adventure.| Region: oceania|Budget: Mid-range"
337,Cebu,Philippines,"Tropical warmth, vibrant street life, and a mix of modern and historic sites create an inviting atmosphere full of discovery and relaxation.| Region: asia|Budget: Budget"
338,Lisbon,Portugal,"Hillside streets alive with music, pastel-colored buildings, sunlit plazas, and the scent of fresh pastries give this city an irresistible warmth.| Region: europe|Budget: Mid-range"
339,Brazzaville,Republic of the Congo,"Lush riverfront views and vibrant markets create a lively atmosphere, where the rhythm of life feels both dynamic and welcoming.| Region: africa|Budget: Mid-range"
340,Kigali,Rwanda,Rolling hills meet vibrant city life where markets buzz with energy and the aroma of fresh coffee fills the air.| Region: africa|Budget: Mid-range
341,Apia,Samoa,"Lush tropical gardens, vibrant markets, and the gentle sound of waves create a serene and welcoming atmosphere perfect for unwinding.| Region: oceania|Budget: Mid-range"
342,Gorée Island,Senegal,"Charming cobblestone streets, vibrant colonial architecture, and a poignant history create a deeply moving and enriching experience by the ocean.| Region: africa|Budget: Mid-range"
343,Durban,South Africa,"A vibrant blend of golden beaches, rich Zulu culture, and fragrant Indian spices, creating an inviting atmosphere full of warmth and diversity.| Region: africa|Budget: Mid-range"
344,Bled,Slovenia,"A serene lakeside town where the emerald waters reflect the surrounding mountains, offering a peaceful escape and stunning natural beauty.| Region: europe|Budget: Mid-range"
345,Bilbao,Spain,"A vibrant blend of modern architecture and rich history, with bustling markets, delightful pintxos bars, and the soothing sound of the river.| Region: europe|Budget: Mid-range"
346,Asturias,Spain,"Lush green landscapes meet rugged coastlines, offering a sense of tranquility and adventure with every breathtaking vista and charming village.| Region: europe|Budget: Mid-range"
347,Zermatt,Switzerland,"Nestled amid towering peaks, this charming alpine village offers crisp mountain air, stunning vistas, and a serene escape from the everyday hustle.| Region: europe|Budget: Luxury"
348,Chiang Mai,Thailand,"Lush mountain landscapes and vibrant night markets create a serene yet lively atmosphere, inviting exploration and relaxation at every turn.| Region: asia|Budget: Budget"
349,Kairouan,Tunisia,"Wandering through ancient medinas, the air filled with spices and the call to prayer, immerses you in a rich tapestry of history and culture.| Region: africa|Budget: Budget"
350,Kampala,Uganda,"Bustling streets filled with vibrant markets, the aroma of local cuisine, and a lively cultural scene create an inviting urban adventure.| Region: africa|Budget: Budget"
351,Minneapolis,United States,"A city with vibrant arts scenes, scenic lakeside parks, and diverse neighborhoods, offering a welcoming mix of culture and natural beauty.| Region: north_america|Budget: Mid-range"
352,Denver,United States,"A vibrant mix of urban sophistication and outdoor adventure, with crisp mountain air and a lively arts scene creating an invigorating atmosphere.| Region: north_america|Budget: Mid-range"
353,Glasgow,United Kingdom,"Lively streets filled with music, striking architecture, and a rich cultural scene make every corner of this city feel inviting and vibrant.| Region: europe|Budget: Mid-range"
354,Ushuaia,Argentina,"A windswept frontier town with dramatic landscapes, where the end of the world feels both mysterious and beautifully remote.| Region: south_america|Budget: Mid-range"
355,Tucson,United States,"Vibrant desert landscapes, stunning sunsets, and a rich blend of Native American and Mexican cultures make every moment feel uniquely captivating.| Region: north_america|Budget: Mid-range"
356,Pittsburgh,United States,"Charming riverside views, vibrant arts districts, and a rich industrial history create a welcoming atmosphere full of cultural and culinary discoveries.| Region: north_america|Budget: Mid-range"
357,Adelaide,Australia,"Charming streets lined with historic buildings and lush parks offer a laid-back vibe, perfect for leisurely strolls and enjoying local wines.| Region: oceania|Budget: Mid-range"
358,Manama,Bahrain,"A blend of modern skyscrapers and traditional souks, offering a warm, welcoming atmosphere with the aroma of spices and sea breezes.| Region: middle_east|Budget: Mid-range"
359,La Paz,Bolivia,"High-altitude streets buzz with vibrant markets, colorful textiles, and a unique blend of indigenous culture and modern city life.| Region: south_america|Budget: Budget"
360,Montevideo,Uruguay,"Strolling along the rambla with the ocean breeze, discovering vibrant street art, and savoring local mate create a welcoming and laid-back vibe.| Region: south_america|Budget: Mid-range"
361,Mendoza,Argentina,"Vineyards stretch across sunlit valleys, offering rich aromas and flavors, while the Andes provide a breathtaking backdrop to this relaxed, wine-loving region.| Region: south_america|Budget: Mid-range"
362,Innsbruck,Austria,"Nestled in the heart of the Alps, this city offers stunning mountain views, charming old town streets, and a blend of urban and outdoor adventures.| Region: europe|Budget: Mid-range"
363,Washington DC,United States,"Monument-lined streets, vibrant museums, and lively neighborhoods create an engaging atmosphere, blending history with modern culture and diverse culinary experiences.| Region: north_america|Budget: Mid-range"
364,Brussels,Belgium,"Charming cobblestone streets, the scent of fresh waffles, and vibrant squares create an inviting atmosphere perfect for leisurely exploration.| Region: europe|Budget: Mid-range"
365,Ottawa,Canada,"Charming streets lined with historic architecture meet lush green parks, offering a peaceful yet vibrant atmosphere perfect for leisurely exploration.| Region: north_america|Budget: Mid-range"
366,Brno,Czech Republic,"Charming cobblestone streets and vibrant student life create an inviting energy, while historic architecture and cozy cafés offer delightful moments of discovery.| Region: europe|Budget: Budget"
367,Tartu,Estonia,"Charming cobblestone streets and vibrant student life create a lively yet laid-back atmosphere, perfect for exploring quaint cafes and historic architecture.| Region: europe|Budget: Budget"
368,Praia,Cape Verde,"Colorful markets, lively music, and ocean breezes create a vibrant yet laid-back atmosphere that invites you to explore and unwind.| Region: africa|Budget: Mid-range"
369,Harbin,China,"A winter wonderland with intricate ice sculptures, bustling street markets, and the aroma of hearty local dishes filling the crisp air.| Region: asia|Budget: Mid-range"
370,Moroni,Comoros,Winding streets lined with colorful markets and the aroma of spices create a lively yet laid-back atmosphere by the Indian Ocean.| Region: africa|Budget: Budget
371,Prague,Czech Republic,"Cobblestone streets and Gothic architecture create a fairytale-like atmosphere, where historic charm and modern culture blend seamlessly along the river.| Region: europe|Budget: Mid-range"
372,Beijing,China,"A dynamic blend of ancient history and modern innovation, with bustling markets, serene temples, and the aroma of sizzling street food.| Region: asia|Budget: Mid-range"
373,Lhasa,China,High-altitude streets filled with the scent of incense and the sound of prayer wheels create a serene yet vibrant atmosphere.| Region: asia|Budget: Luxury
374,Aswan,Egypt,"Tranquil river views and ancient temples offer a serene escape, with warm breezes and the gentle flow of the Nile setting the pace.| Region: africa|Budget: Budget"
375,Rijeka,Croatia,"Coastal breezes meet lively streets filled with music and laughter, while historic architecture and vibrant markets create a welcoming, dynamic atmosphere.| Region: europe|Budget: Mid-range"
376,Cuenca,Ecuador,"Cobblestone streets lined with colonial architecture and vibrant markets create a charming atmosphere, inviting you to explore its rich cultural heritage.| Region: south_america|Budget: Budget"
377,Giza,Egypt,The awe-inspiring sight of ancient pyramids rising from the golden desert sands creates an atmosphere of timeless wonder and historical intrigue.| Region: africa|Budget: Mid-range
378,Saaremaa Island,Estonia,"Gentle sea breezes, serene coastal landscapes, and charming villages offer a peaceful escape that encourages you to unwind and explore leisurely.| Region: europe|Budget: Budget"
379,Venice,Italy,"Winding canals, charming gondolas, and historic architecture create a romantic atmosphere, where every corner reveals a new story and hidden gem.| Region: europe|Budget: Luxury"
380,Rennes,France,"Charming streets lined with timber-framed houses, lively markets, and a vibrant student atmosphere create a welcoming and dynamic experience.| Region: europe|Budget: Mid-range"
381,Papeete,French Polynesia,"A tropical blend of vibrant markets, lush landscapes, and the gentle sound of waves creates a serene yet lively island atmosphere.| Region: oceania|Budget: Luxury"
382,Lyon,France,"Charming cobblestone streets, riverside views, and an irresistible culinary scene make every moment feel like a delightful discovery.| Region: europe|Budget: Mid-range"
383,Bora Bora,French Polynesia,"Turquoise lagoons and lush green mountains create a serene paradise, where the gentle ocean breeze and vibrant sunsets captivate your senses.| Region: oceania|Budget: Luxury"
384,Carcassone,France,"Wandering through narrow cobblestone streets, you feel the weight of history enveloped by ancient walls, with the aroma of rustic French cuisine lingering.| Region: europe|Budget: Mid-range"
385,Osaka,Japan,"Bustling streets filled with neon lights, delicious street food aromas, and the energetic hum of friendly locals create a lively urban vibe.| Region: asia|Budget: Luxury"
386,Banjul,Gambia,"Bustling markets filled with vibrant colors and the aroma of spices, alongside tranquil river views, create a welcoming and lively atmosphere.| Region: africa|Budget: Budget"
387,Hamburg,Germany,"A lively port city where historic architecture meets modern design, offering a relaxed vibe with waterfront strolls and bustling markets.| Region: europe|Budget: Mid-range"
