city_id,city_name,country,description
1,Milan,Italy,"Chic streets lined with fashion boutiques, historic architecture, and lively piazzas create a sophisticated yet welcoming atmosphere, perfect for leisurely exploration.| Region: europe|Budget: Luxury"
2,Yasawa Islands,Fiji,"Crystal-clear waters, secluded beaches, and vibrant coral reefs create a serene paradise perfect for unwinding and immersing in natural beauty.| Region: oceania|Budget: Luxury"
3,Whistler,Canada,"Snow-capped peaks and lush forests create a serene escape, where outdoor adventures meet cozy village vibes and crisp mountain air.| Region: north_america|Budget: Luxury"
4,Guanajuato,Mexico,"Winding cobblestone streets and colorful facades create a charming, vibrant atmosphere, where history and lively festivals fill the air with excitement.| Region: north_america|Budget: Mid-range"
5,Surabaya,Indonesia,"Bustling streets filled with the aroma of local spices, vibrant markets, and a rich cultural tapestry invite exploration and discovery.| Region: asia|Budget: Budget"
6,Nuuk,Greenland,"Rugged landscapes meet the calm of icy fjords, where the crisp air and vibrant local culture create a unique Arctic charm.| Region: north_america|Budget: Luxury"
7,Windhoek,Namibia,"A blend of modernity and tradition, with bustling markets, German colonial architecture, and the vast Namibian landscape providing a unique backdrop.| Region: africa|Budget: Mid-range"
8,Kingston,Jamaica,"Vibrant streets pulse with reggae rhythms, while lush hills and beaches offer a serene escape, creating a captivating blend of energy and tranquility.| Region: north_america|Budget: Mid-range"
9,Nafplio,Greece,"Charming cobblestone streets, vibrant bougainvillea, and the gentle sea breeze create a serene atmosphere perfect for leisurely exploration and relaxation.| Region: europe|Budget: Mid-range"
10,Tbilisi,Georgia,"Cobblestone streets wind through eclectic neighborhoods, where vibrant markets and ancient architecture create a welcoming blend of history and modern charm.| Region: asia|Budget: Budget"
11,Heidelberg,Germany,"Cobblestone streets lined with charming old buildings and the gentle flow of the Neckar River create an inviting, romantic atmosphere.| Region: europe|Budget: Mid-range"
12,Hobart,Australia,"Charming waterfront views and a laid-back vibe invite exploration through historic streets, bustling markets, and the surrounding natural beauty of rugged landscapes.| Region: oceania|Budget: Mid-range"
13,Nagasaki,Japan,"Steeped in history and surrounded by lush hills, this city offers a poignant mix of serene gardens and vibrant cultural experiences.| Region: asia|Budget: Mid-range"
14,Utrecht,Netherlands,"Charming canals lined with cozy cafés and historic buildings create a warm, inviting atmosphere perfect for leisurely strolls and quiet exploration.| Region: europe|Budget: Mid-range"
15,Bagan,Myanmar,"Ancient temples rise from misty plains, where the golden glow of sunrise paints a serene landscape that feels both timeless and mystical.| Region: asia|Budget: Budget"
16,Malmö,Sweden,"Charming canals, innovative architecture, and a laid-back vibe make it perfect for leisurely strolls and exploring vibrant cultural scenes.| Region: europe|Budget: Mid-range"
17,Amsterdam,Netherlands,"Charming canals wind through vibrant neighborhoods, where historic architecture meets cozy cafés and the air buzzes with a creative energy.| Region: europe|Budget: Mid-range"
18,New York,United States,"The city buzzes with energy, offering iconic skylines, diverse cultures, and a sensory overload of sights, sounds, and tastes at every corner.| Region: north_america|Budget: Luxury"
19,Chicago,United States,"Dynamic streets filled with diverse food, vibrant arts, and stunning architecture create a lively yet welcoming urban atmosphere by the lake.| Region: north_america|Budget: Luxury"
20,Raleigh,United States,"Tree-lined streets and historic architecture mix with modern art scenes and vibrant food markets, offering a warm, welcoming southern charm.| Region: north_america|Budget: Mid-range"
21,Trondheim,Norway,"Charming wooden houses, crisp Nordic air, and a vibrant student atmosphere create a cozy yet lively vibe that''s both welcoming and invigorating.| Region: europe|Budget: Luxury"
22,Bruges,Belgium,"Cobblestone streets lined with medieval architecture and the aroma of fresh waffles create a charming and nostalgic atmosphere, perfect for leisurely exploration.| Region: europe|Budget: Mid-range"
23,Reykjavik,Iceland,"Colorful rooftops, crisp sea air, and the allure of geothermal pools create a unique blend of natural beauty and urban charm.| Region: europe|Budget: Luxury"
24,Seoul,South Korea,"A dynamic blend of futuristic skyscrapers and ancient palaces, bustling markets, and tranquil parks, creating an energetic yet harmonious urban experience.| Region: asia|Budget: Mid-range"
25,Ankara,Turkey,"A blend of modern and historic vibes, offering bustling markets, serene parks, and a rich tapestry of cultural experiences.| Region: asia|Budget: Mid-range"
26,Kyoto,Japan,"Serene temples and vibrant gardens blend with the gentle rustle of bamboo forests, creating a tranquil yet deeply enriching experience.| Region: asia|Budget: Luxury"
27,Tampa,United States,"Sun-drenched streets, vibrant waterfronts, and a lively cultural scene create an inviting mix of relaxation and adventure for visitors.| Region: north_america|Budget: Mid-range"
28,Dublin,Ireland,"Charming cobblestone streets, lively pubs filled with music, and a rich tapestry of history create a welcoming and vibrant atmosphere.| Region: europe|Budget: Mid-range"
29,Washington,United States,"Majestic landscapes blend with vibrant city life, offering a mix of natural beauty, cultural richness, and a welcoming atmosphere.| Region: north_america|Budget: Mid-range"
30,Livingstone,Zambia,"Feel the rush of cascading waterfalls and the thrill of wildlife encounters, all amidst a backdrop of vibrant sunsets and warm local hospitality.| Region: africa|Budget: Mid-range"
31,Kraków,Poland,"Cobblestone streets lead to vibrant squares filled with the buzz of locals and tourists alike, offering a blend of history and lively culture.| Region: europe|Budget: Mid-range"
32,Petra,Jordan,"Wandering through ancient canyons, you''ll feel the echoes of history in the rose-red stone, with every step revealing stunning, time-worn architecture.| Region: middle_east|Budget: Mid-range"
33,Athens,Greece,"Ancient ruins stand proudly against a backdrop of vibrant street life and bustling markets, where history and modernity create an electrifying blend.| Region: europe|Budget: Mid-range"
34,Malé,Maldives,"Vibrant markets, azure waters, and the gentle hum of island life create an inviting atmosphere that feels both exotic and familiar.| Region: asia|Budget: Mid-range"
35,Austin,United States,"Live music spills from vibrant bars, food trucks serve up eclectic flavors, and the warm, welcoming vibe makes you feel instantly at home.| Region: north_america|Budget: Mid-range"
36,Pago Pago,American Samoa,"Lush green mountains meet crystal-clear waters, where laid-back island vibes and vibrant Polynesian culture create a welcoming and serene atmosphere.| Region: oceania|Budget: Mid-range"
37,Luanda,Angola,"A bustling port city with vibrant markets, lively music scenes, and a warm coastal breeze that invites exploration and discovery.| Region: africa|Budget: Mid-range"
38,New Orleans,United States,"Lively streets echo with jazz, while the scent of Creole cuisine fills the air, creating a vibrant and soulful experience.| Region: north_america|Budget: Mid-range"
39,Raja Ampat,Indonesia,"Crystal-clear waters teeming with vibrant marine life and secluded islands offer a serene escape, perfect for snorkeling and diving enthusiasts seeking adventure.| Region: asia|Budget: Luxury"
40,Hamilton Island,Australia,"Turquoise waters and lush landscapes create a serene escape, where gentle sea breezes and vibrant sunsets offer a perfect island retreat.| Region: oceania|Budget: Luxury"
41,Melbourne,Australia,"A vibrant mix of street art, diverse cuisine, and lively laneways create an atmosphere that''s both exciting and warmly inviting.| Region: oceania|Budget: Mid-range"
42,Puebla,Mexico,"Cobblestone streets filled with vibrant colors, lively markets, and the aroma of rich mole create an inviting and warm atmosphere.| Region: north_america|Budget: Mid-range"
43,Richmond,United States,"Historic streets lined with charming brick buildings, vibrant art scenes, and the gentle flow of the James River create a welcoming atmosphere.| Region: north_america|Budget: Mid-range"
44,Bridgetown,Barbados,"Warm ocean breezes mingle with the rhythmic beats of calypso music, creating an inviting atmosphere perfect for unwinding and exploration.| Region: north_america|Budget: Mid-range"
45,Oaxaca City,Mexico,Colorful streets filled with vibrant markets and the aroma of rich mole sauces create a warm and inviting cultural tapestry.| Region: north_america|Budget: Mid-range
46,San Sebastián,Spain,"Golden beaches meet vibrant pintxo bars and lush green hills, creating a lively yet laid-back atmosphere perfect for unwinding and exploring.| Region: europe|Budget: Mid-range"
47,Sedona,United States,"Red rock formations create a stunning backdrop for peaceful hikes, art galleries, and spiritual retreats, offering a serene escape from the everyday hustle.| Region: north_america|Budget: Mid-range"
48,Cotonou,Benin,"Bustling markets, vibrant street life, and warm coastal breezes create an inviting atmosphere filled with rich cultural experiences and local charm.| Region: africa|Budget: Budget"
49,Sarajevo,Bosnia and Herzegovina,"Cobblestone streets echo with the sound of church bells and the call to prayer, creating a unique blend of cultures and histories.| Region: europe|Budget: Budget"
50,Tirana,Albania,"Vibrant streets filled with eclectic architecture, lively markets, and welcoming locals create an inviting atmosphere that feels both dynamic and laid-back.| Region: europe|Budget: Budget"
51,Rio de Janeiro,Brazil,"Vibrant streets pulse with samba rhythms, stunning beaches meet lush mountains, and every corner offers a burst of color and life.| Region: south_america|Budget: Mid-range"
52,Curitiba,Brazil,"Lush parks, innovative urban design, and a blend of cultures create a refreshing and vibrant cityscape that feels both modern and welcoming.| Region: south_america|Budget: Mid-range"
53,Phnom Penh,Cambodia,"Bustling streets filled with the aroma of street food, vibrant markets, and a rich tapestry of history create an unforgettable atmosphere.| Region: asia|Budget: Budget"
54,Fès,Morocco,"Winding alleys filled with vibrant souks, the aroma of spices, and the sound of artisans at work create an enchanting, timeless atmosphere.| Region: africa|Budget: Budget"
55,Toronto,Canada,"Dynamic streets buzzing with diverse cultures, vibrant art scenes, and a skyline that hugs the shimmering lake make for an inviting urban experience.| Region: north_america|Budget: Mid-range"
56,Lucca,Italy,"Wander through cobblestone streets surrounded by ancient walls, where charming piazzas and the aroma of fresh Italian cuisine fill the air.| Region: europe|Budget: Mid-range"
57,Edmonton,Canada,"Wide-open streets, a lively arts scene, and vibrant festivals create a welcoming atmosphere that feels both dynamic and comfortably laid-back.| Region: north_america|Budget: Mid-range"
58,Barcelona,Spain,"Vibrant streets filled with Gaudí''s whimsical architecture, lively tapas bars, and the warm Mediterranean breeze create an inviting and dynamic atmosphere.| Region: europe|Budget: Mid-range"
59,Banff,Canada,"Majestic mountains, crystal-clear lakes, and fresh alpine air create a breathtakingly serene atmosphere, perfect for nature lovers and adventure seekers alike.| Region: north_america|Budget: Luxury"
60,Maputo,Mozambique,"Bustling markets, vibrant street life, and the rhythmic sounds of local music create a lively and colorful atmosphere to explore.| Region: africa|Budget: Mid-range"
61,Dar es Salaam,Tanzania,"Lively markets, vibrant street life, and the warm Indian Ocean breeze create a dynamic and welcoming atmosphere full of local charm.| Region: africa|Budget: Budget"
62,Hamilton,Bermuda,"Charming streets lined with pastel buildings and the gentle sea breeze create a laid-back, yet vibrant island atmosphere.| Region: north_america|Budget: Luxury"
63,Santiago de Chile,Chile,"A vibrant city where modern skyscrapers meet historic streets, offering stunning mountain views and a lively cultural scene full of energy.| Region: south_america|Budget: Mid-range"
64,Shanghai,China,"Vibrant streets pulse with energy, blending futuristic skyscrapers with ancient temples, while enticing aromas from street food stalls fill the air.| Region: asia|Budget: Mid-range"
65,Kathmandu,Nepal,"Nestled in a valley surrounded by towering peaks, the city buzzes with vibrant markets, ancient temples, and the aroma of spices.| Region: asia|Budget: Budget"
66,Auckland,New Zealand,"A lively harbor city where lush landscapes meet urban sophistication, offering a vibrant mix of cultures, flavors, and stunning coastal views.| Region: oceania|Budget: Mid-range"
67,Québec City,Canada,"Cobblestone streets and historic architecture create a charming, old-world atmosphere, while the aroma of fresh pastries fills the crisp air.| Region: north_america|Budget: Mid-range"
68,Bogotá,Colombia,"A vibrant mix of colonial charm and modern energy, with bustling markets, rich history, and stunning mountain views that invigorate the senses.| Region: south_america|Budget: Mid-range"
69,Avarua,Cook Islands,"Tropical breezes and stunning ocean views create a laid-back island vibe, inviting you to unwind and soak in the serene beauty.| Region: oceania|Budget: Mid-range"
70,Izmir,Turkey,"Coastal breezes carry the scent of the sea through bustling markets and lively streets, offering a vibrant yet laid-back Mediterranean vibe.| Region: asia|Budget: Mid-range"
71,Skopje,North Macedonia,"Wandering through eclectic streets, you''ll encounter a blend of ancient history and modern quirks, with vibrant markets and grand statues at every turn.| Region: europe|Budget: Budget"
72,Cartagena,Colombia,"Winding cobblestone streets, vibrant colonial architecture, and the rhythmic sound of salsa create a lively and colorful coastal atmosphere.| Region: south_america|Budget: Mid-range"
73,Dubrovnik,Croatia,"Wander through ancient stone streets, bask in the Adriatic sun, and feel the blend of history and sea breeze at every corner.| Region: europe|Budget: Mid-range"
74,Bergen,Norway,"Charming waterfront views, colorful wooden houses, and the fresh scent of sea air make this coastal city feel both cozy and invigorating.| Region: europe|Budget: Luxury"
75,Bocas del Toro,Panama,"Crystal-clear waters lap against palm-fringed beaches, while vibrant marine life and laid-back island vibes create an unforgettable tropical escape.| Region: north_america|Budget: Mid-range"
76,Santo Domingo,Dominican Republic,"Lively streets filled with the sound of merengue, colonial architecture, and the aroma of local cuisine create an inviting and vibrant atmosphere.| Region: north_america|Budget: Mid-range"
77,Baños,Ecuador,"Lush green mountains, steaming thermal pools, and the thrill of adventure sports create an exhilarating yet serene escape in this enchanting town.| Region: south_america|Budget: Budget"
78,Cairo,Egypt,"Bustling streets filled with vibrant markets, the aroma of spices, and the awe-inspiring sight of ancient pyramids create an unforgettable experience.| Region: africa|Budget: Budget"
79,Iquitos,Peru,"Lush rainforests, vibrant markets, and the hum of riverboats create an atmosphere buzzing with life and natural wonder.| Region: south_america|Budget: Budget"
80,Charlotte,United States,"Bustling streets lined with towering trees, vibrant arts scenes, and a warm Southern hospitality create a welcoming and lively atmosphere.| Region: north_america|Budget: Mid-range"
81,Marseille,France,"A lively port city with Mediterranean flair, bustling markets, and a mix of historic charm and modern vibrancy, offering endless exploration.| Region: europe|Budget: Mid-range"
82,Malabo,Equatorial Guinea,"Tropical breezes mingle with the vibrant energy of colorful markets and lively streets, offering a warm and welcoming cultural experience.| Region: africa|Budget: Mid-range"
83,Mbabane,Eswatini,"Surrounded by lush mountains, the city offers a relaxed atmosphere where vibrant markets and friendly locals create an inviting experience.| Region: africa|Budget: Budget"
84,Sofia,Bulgaria,"Charming streets lined with eclectic architecture and vibrant markets invite you to immerse in a blend of history, culture, and modern energy.| Region: europe|Budget: Budget"
85,San Marino,San Marino,"Perched atop rolling hills, this charming enclave offers medieval towers, cobblestone streets, and sweeping vistas, inviting a leisurely exploration of its storied past.| Region: europe|Budget: Mid-range"
86,Berlin,Germany,"Eclectic streets filled with history, art, and a dynamic cultural scene create an atmosphere that''s both invigorating and deeply engaging.| Region: europe|Budget: Mid-range"
87,Helsinki,Finland,"A blend of modern design and serene nature, where crisp air and cozy cafes invite you to unwind and explore.| Region: europe|Budget: Mid-range"
88,Warsaw,Poland,"Historic streets blend with modern vibes, where cozy cafes and vibrant squares invite leisurely strolls and a taste of local culture.| Region: europe|Budget: Mid-range"
89,Verona,Italy,"Charming streets with a romantic vibe, historic architecture, and cozy piazzas invite leisurely strolls and delightful discoveries at every turn.| Region: europe|Budget: Mid-range"
90,Annecy,France,"Charming canals and cobblestone streets weave through a picturesque town, surrounded by stunning alpine views and the serene waters of a crystal-clear lake.| Region: europe|Budget: Mid-range"
91,Colombo,Sri Lanka,"Lively streets filled with the aroma of spices, historic temples, and a coastal breeze create a vibrant and welcoming atmosphere.| Region: asia|Budget: Budget"
92,Fraser Island,Australia,"Endless stretches of sandy beaches, lush rainforests, and crystal-clear freshwater lakes create a serene escape filled with natural wonders and tranquility.| Region: oceania|Budget: Mid-range"
93,Dakar,Senegal,"Bustling markets, rhythmic music, and vibrant street life create an energetic atmosphere that''s both captivating and welcoming.| Region: africa|Budget: Mid-range"
94,Wadi Rum,Jordan,"Expansive red sands and towering sandstone cliffs create a surreal landscape, inviting exploration and offering moments of profound tranquility under star-filled skies.| Region: middle_east|Budget: Mid-range"
95,Munich,Germany,"Historic streets filled with the aroma of pretzels and beer, vibrant festivals, and a charming blend of tradition and modernity await.| Region: europe|Budget: Mid-range"
96,Freiburg,Germany,"Charming cobblestone streets, lush greenery, and a welcoming vibe create a perfect blend of nature and history, inviting you to explore leisurely.| Region: europe|Budget: Mid-range"
97,Singapore,Singapore,"A bustling cityscape where futuristic architecture meets lush green spaces, offering a vibrant blend of cultures and flavors at every corner.| Region: asia|Budget: Luxury"
98,Piran,Slovenia,Charming cobblestone streets lead you through a town where the sea breeze mingles with the aroma of fresh seafood and vibrant markets.| Region: europe|Budget: Mid-range
99,Valletta,Malta,Sun-drenched streets lined with baroque architecture and vibrant markets create a charming blend of history and lively Mediterranean spirit.| Region: europe|Budget: Mid-range
100,Thessaloniki,Greece,"Lively waterfronts, aromatic tavernas, and ancient ruins blend seamlessly with a youthful energy that invites exploration and leisurely enjoyment.| Region: europe|Budget: Mid-range"
101,Georgetown,Guyana,"Lush greenery and colonial architecture meet vibrant local markets and a lively Caribbean vibe, offering a unique and welcoming atmosphere.| Region: south_america|Budget: Budget"
102,Jeju Island,South Korea,"Lush green landscapes, volcanic craters, and serene beaches create a tranquil escape, perfect for soaking in natural beauty and peaceful vibes.| Region: asia|Budget: Mid-range"
274,Sibiu,Romania,"Charming cobblestone streets and vibrant squares create a cozy atmosphere, inviting you to explore its rich history and welcoming local culture.| Region: europe|Budget: Budget"
103,Valencia,Spain,"Sun-drenched streets lined with orange trees, vibrant markets, and a seamless blend of ancient history and modern art create a captivating atmosphere.| Region: europe|Budget: Mid-range"
104,Hoi An,Vietnam,"Charming lantern-lit streets, bustling markets, and the scent of fresh herbs create an inviting atmosphere that feels both timeless and vibrant.| Region: asia|Budget: Budget"
105,Kolkata,India,"Bustling streets filled with the aroma of spices, vibrant markets, and colonial architecture create an inviting atmosphere full of life and history.| Region: asia|Budget: Budget"
106,Budapest,Hungary,"Charming streets lined with historic architecture and lively ruin bars create a welcoming vibe, where tradition meets a vibrant, modern energy.| Region: europe|Budget: Mid-range"
107,Yogyakarta,Indonesia,"A vibrant blend of traditional Javanese culture and modern energy, where bustling markets and ancient temples create a rich sensory tapestry.| Region: asia|Budget: Budget"
108,Monaco,Monaco,"Glamorous streets lined with luxury cars and yachts, where the Mediterranean breeze mingles with the scent of high-end cuisine and opulence.| Region: europe|Budget: Luxury"
109,Rome,Italy,"Ancient ruins stand proudly amidst bustling piazzas, where the aroma of fresh pasta and the echoes of street musicians fill the air.| Region: europe|Budget: Mid-range"
110,Stockholm,Sweden,"Charming waterfronts, crisp Nordic air, and a seamless blend of old-world charm and modern design create a unique and inviting atmosphere.| Region: europe|Budget: Luxury"
111,Taipei,Taiwan,"Bustling night markets filled with tantalizing aromas, serene temples, and lush green hills create a vibrant and welcoming atmosphere.| Region: asia|Budget: Mid-range"
112,Tokyo,Japan,"Neon-lit streets pulse with energy, while serene gardens and ancient temples offer a peaceful escape, creating a captivating blend of modernity and tradition.| Region: asia|Budget: Luxury"
113,Noumea,New Caledonia,"A tropical blend of French sophistication and island charm, with vibrant markets, azure waters, and a laid-back, sun-soaked vibe.| Region: oceania|Budget: Luxury"
114,Palermo,Italy,"Sun-drenched streets filled with the aroma of street food, lively markets, and stunning architecture create an enchanting and vibrant atmosphere.| Region: europe|Budget: Mid-range"
115,Sicily,Italy,"Sun-drenched landscapes, aromatic citrus groves, and vibrant markets create a sensory feast, while ancient ruins whisper stories of a rich, layered history.| Region: europe|Budget: Mid-range"
116,Amman,Jordan,"Bustling markets, aromatic spices, and ancient ruins create a vibrant atmosphere that blends history with the lively rhythms of modern life.| Region: middle_east|Budget: Mid-range"
117,Nairobi,Kenya,"Bustling streets filled with colorful markets, the aroma of street food, and a lively mix of cultures create a dynamic urban experience.| Region: africa|Budget: Mid-range"
118,Panama City,Panama,Humid evenings and skyscraper views contrast beautifully with colorful historic quarters and lush jungle landscapes within easy reach.| Region: north_america|Budget: Mid-range
119,Nagoya,Japan,"A city where modern skyscrapers meet historic castles, offering a rich blend of tradition and innovation with a laid-back vibe.| Region: asia|Budget: Luxury"
120,Fukuoka,Japan,"Coastal breezes blend with vibrant city life, offering a friendly atmosphere, delicious street food, and a seamless mix of modern and traditional experiences.| Region: asia|Budget: Mid-range"
121,Maseru,Lesotho,"Surrounded by dramatic landscapes, this city offers a blend of bustling markets, friendly locals, and a unique cultural tapestry to explore.| Region: africa|Budget: Budget"
122,Mexico City,Mexico,"Vibrant streets teeming with life, colorful markets, and the aroma of street food create an eclectic and exhilarating urban experience.| Region: north_america|Budget: Mid-range"
123,Doha,Qatar,"Modern architecture meets traditional souks, with the aroma of spices and the warm desert breeze creating a welcoming and vibrant atmosphere.| Region: middle_east|Budget: Luxury"
124,Astana,Kazakhstan,"Futuristic architecture and expansive boulevards create a surreal atmosphere, blending modernity with cultural depth, offering an intriguing and unique urban experience.| Region: asia|Budget: Mid-range"
125,Luang Prabang,Laos,"Serene streets lined with French colonial architecture, vibrant night markets, and the gentle flow of the Mekong River create a peaceful, timeless charm.| Region: asia|Budget: Budget"
126,Oaxaca,Mexico,"Colorful markets, aromatic street food, and vibrant festivals create an immersive experience that feels both lively and deeply rooted in tradition.| Region: north_america|Budget: Mid-range"
127,Kaunas,Lithuania,"Charming cobblestone streets, vibrant street art, and a laid-back vibe invite you to explore its rich history and creative energy.| Region: europe|Budget: Budget"
128,Podgorica,Montenegro,"A blend of modern and traditional vibes, where lively streets meet serene parks, offering a warm and welcoming atmosphere.| Region: europe|Budget: Budget"
129,Kuching,Malaysia,"A blend of colonial charm and vibrant markets, with lush greenery and the gentle flow of the Sarawak River creating a serene atmosphere.| Region: asia|Budget: Budget"
