city_id,city_name,country,description
388,Vilnius,Lithuania,"Charming cobblestone streets and baroque architecture blend with a youthful energy, offering a cozy yet vibrant atmosphere perfect for leisurely exploration.| Region: europe|Budget: Budget"
389,San Cristobal,Venezuela,"A lively blend of bustling markets, friendly locals, and the refreshing mountain air creates a welcoming and invigorating atmosphere.| Region: south_america|Budget: Budget"
390,Lübeck,Germany,Charming cobblestone streets lined with medieval architecture and the scent of marzipan create an inviting and cozy atmosphere for exploration.| Region: europe|Budget: Mid-range
391,Antigua,Guatemala,Cobblestone streets lined with colorful colonial buildings and vibrant markets create an enchanting atmosphere that feels both historic and warmly inviting.| Region: north_america|Budget: Budget
392,Akureyri,Iceland,"Nestled by stunning fjords, this charming town offers a cozy vibe with colorful houses and a backdrop of snow-capped mountains.| Region: europe|Budget: Luxury"
393,Varanasi,India,Winding alleyways filled with the scent of incense and the sound of temple bells create a spiritual and vibrant atmosphere by the river.| Region: asia|Budget: Budget
394,Ajaccio,France,"Nestled between mountains and sea, this charming coastal town offers sunlit streets, vibrant markets, and a rich tapestry of history and culture.| Region: europe|Budget: Mid-range"
395,Tanna Island,Vanuatu,"Lush jungles, volcanic landscapes, and welcoming locals create a serene and adventurous atmosphere, inviting you to explore and unwind.| Region: oceania|Budget: Mid-range"
396,Ho Chi Minh City,Vietnam,"Bustling streets filled with the aroma of street food and the hum of scooters create a vibrant, energetic atmosphere that''s uniquely captivating.| Region: asia|Budget: Budget"
397,York,United Kingdom,"Charming cobblestone streets and ancient city walls create a cozy, inviting atmosphere, where history and modern vibrancy coexist beautifully.| Region: europe|Budget: Mid-range"
398,Delhi,India,"Bustling streets filled with vibrant colors, diverse aromas, and the sounds of life create an energetic and unforgettable experience.| Region: asia|Budget: Budget"
399,Matera,Italy,"Winding stone streets and ancient cave dwellings create an atmosphere of timeless mystery, inviting you to explore its unique history and charm.| Region: europe|Budget: Mid-range"
400,Hiroshima,Japan,"A serene blend of reflective history and modern vibrancy, where tranquil gardens meet bustling streets, offering a deeply moving yet uplifting experience.| Region: asia|Budget: Mid-range"
401,Vientiane,Laos,"Tranquil streets lined with French colonial architecture, vibrant markets, and serene temples create a peaceful yet culturally rich experience.| Region: asia|Budget: Budget"
402,Edinburgh,United Kingdom,"Charming cobblestone streets, historic castles, and the sound of bagpipes create a magical atmosphere that feels both ancient and alive.| Region: europe|Budget: Mid-range"
403,Lusaka,Zambia,"Bustling markets, vibrant local culture, and open green spaces create a lively yet laid-back atmosphere that''s both welcoming and engaging.| Region: africa|Budget: Budget"
404,Marrakesh,Morocco,"A sensory feast of vibrant colors, aromatic spices, bustling souks, and serene gardens, creating an enchanting and immersive experience for every visitor.| Region: africa|Budget: Budget"
405,Palawan,Philippines,"Crystal-clear waters, lush green landscapes, and vibrant marine life create a serene escape where relaxation and adventure blend seamlessly.| Region: asia|Budget: Budget"
406,Ohrid,North Macedonia,"Charming lakeside views, ancient cobblestone streets, and the scent of fresh coffee create a peaceful yet vibrant atmosphere perfect for unwinding.| Region: europe|Budget: Budget"
407,Algarve,Portugal,"Golden cliffs and serene beaches meet charming villages, where the scent of grilled sardines and the sound of ocean waves fill the air.| Region: europe|Budget: Mid-range"
408,Bucharest,Romania,"Tree-lined boulevards, eclectic architecture, and lively squares invite you to explore a city where history and modernity coexist seamlessly.| Region: europe|Budget: Budget"
409,Seychelles,Seychelles,"Imagine pristine beaches with powdery sand, lush greenery, and the gentle sound of waves, offering a serene and rejuvenating escape.| Region: africa|Budget: Luxury"
410,Zurich,Switzerland,Charming streets lined with elegant boutiques and cozy cafes offer a blend of modern sophistication and rich historical charm.| Region: europe|Budget: Luxury
411,Dubai,United Arab Emirates,"Skyscrapers glisten under the sun, luxury blends with tradition, and the aroma of spices fills the air, creating a uniquely vibrant experience.| Region: middle_east|Budget: Luxury"
412,Zanzibar,Tanzania,"White sandy beaches, turquoise waters, and the scent of spices fill the air, creating an enchanting and laid-back island vibe.| Region: africa|Budget: Mid-range"
413,Atlanta,United States,"Bustling streets lined with lush trees, vibrant arts scenes, and a welcoming Southern charm create a warm and dynamic urban experience.| Region: north_america|Budget: Mid-range"
414,Thimphu,Bhutan,"Nestled in the mountains, this city blends serene monasteries with colorful markets, offering a unique blend of tradition and tranquility.| Region: asia|Budget: Luxury"
415,Los Angeles,United States,"Endless sunshine, diverse neighborhoods, and the allure of Hollywood create a dynamic atmosphere where every street feels like a new adventure.| Region: north_america|Budget: Luxury"
416,Savannah,United States,"Cobblestone streets lined with moss-draped oaks create a charming, historic atmosphere, inviting leisurely strolls and a sense of Southern hospitality.| Region: north_america|Budget: Mid-range"
417,Bukhara,Uzbekistan,"Wandering through ancient streets, you''ll feel the echoes of history in every corner, with vibrant markets and the scent of spices filling the air.| Region: asia|Budget: Budget"
418,Montreal,Canada,"Charming streets filled with a mix of European elegance and North American vibrancy, offering lively festivals, diverse cuisine, and artistic flair.| Region: north_america|Budget: Mid-range"
419,Hanoi,Vietnam,"Bustling streets filled with the aroma of street food, lively markets, and serene lakes create a vibrant yet peaceful atmosphere.| Region: asia|Budget: Budget"
420,Perth,Australia,"Sun-kissed beaches meet a laid-back city vibe with sprawling parks, buzzing markets, and a sense of space that feels refreshingly open.| Region: oceania|Budget: Mid-range"
421,Cardiff,United Kingdom,"Charming streets lined with historic architecture and lively pubs create a welcoming atmosphere, where you can feel the city''s rich cultural heartbeat.| Region: europe|Budget: Mid-range"
422,San Jose,United States,"A blend of innovation and natural beauty, with sunlit streets, tech-savvy energy, and nearby escapes to lush parks and rolling hills.| Region: north_america|Budget: Luxury"
423,Orlando,United States,"Theme parks brimming with excitement, vibrant entertainment districts, and sunny afternoons create a lively atmosphere perfect for family adventures and fun-filled days.| Region: north_america|Budget: Mid-range"
424,Sighisoara,Romania,"Cobblestone streets and colorful medieval towers create a fairy-tale setting, inviting you to wander and uncover centuries-old secrets around every corner.| Region: europe|Budget: Budget"
425,Vancouver,Canada,"Nestled between ocean and mountains, this city offers a harmonious blend of urban excitement and serene natural beauty, perfect for outdoor enthusiasts.| Region: north_america|Budget: Luxury"
426,Keswick,United Kingdom,"Surrounded by majestic peaks and serene lakes, this charming town offers a peaceful escape with invigorating hikes and quaint local shops.| Region: europe|Budget: Mid-range"
427,Bologna,Italy,"Strolling under ancient porticoes, savoring rich aromas of fresh pasta, and enjoying lively piazzas create a warm, welcoming atmosphere.| Region: europe|Budget: Mid-range"
428,Isle of Skye,United Kingdom,"Dramatic landscapes with rugged cliffs and serene lochs create an enchanting atmosphere, perfect for exploring nature and experiencing tranquil moments.| Region: europe|Budget: Mid-range"
429,Guimarães,Portugal,"Cobblestone streets, medieval architecture, and a welcoming atmosphere make wandering feel like stepping back in time, rich with history and charm.| Region: europe|Budget: Mid-range"
430,Macau,China,"A unique blend of Portuguese heritage and vibrant Chinese culture, with bustling streets, aromatic food stalls, and dazzling casino lights.| Region: asia|Budget: Mid-range"
431,Salento,Colombia,"Rolling green hills and colorful streets create a welcoming vibe, with coffee aromas and vibrant landscapes offering a true sensory escape.| Region: south_america|Budget: Budget"
432,Zagreb,Croatia,"A blend of charming cobblestone streets, vibrant markets, and lively cafes creates an inviting atmosphere filled with history and modern culture.| Region: europe|Budget: Mid-range"
433,Quito,Ecuador,"Wander through cobblestone streets with vibrant colonial architecture, surrounded by the scent of Andean spices and the hum of lively markets.| Region: south_america|Budget: Budget"
434,San Salvador,El Salvador,"Lively streets buzz with local vendors and colorful markets, while nearby volcanoes and lush landscapes offer a sense of adventure and natural beauty.| Region: north_america|Budget: Budget"
435,Suva,Fiji,"Tropical breezes mingle with the vibrant bustle of markets and the warmth of welcoming locals, creating an inviting and lively atmosphere.| Region: oceania|Budget: Mid-range"
436,Toulouse,France,"Charming cobblestone streets, pink-hued buildings, and a lively café culture create a welcoming atmosphere that''s both vibrant and soothing.| Region: europe|Budget: Mid-range"
437,Frankfurt,Germany,"Skyscrapers and historic charm blend seamlessly, offering a dynamic cityscape where modernity meets tradition, all underlined by a vibrant cultural scene.| Region: europe|Budget: Mid-range"
438,Accra,Ghana,"Lively streets filled with vibrant markets, rhythmic music, and the aroma of spicy street food create a captivating and energetic atmosphere.| Region: africa|Budget: Budget"
439,Cayenne,French Guiana,"Tropical vibes meet colonial charm with bustling markets, vibrant street life, and lush greenery creating a unique and inviting atmosphere.| Region: south_america|Budget: Mid-range"
440,Launceston,Australia,"Charming streets lined with heritage buildings, surrounded by lush parks and vineyards, offer a welcoming atmosphere with a touch of rustic elegance.| Region: oceania|Budget: Mid-range"
441,Valparaíso,Chile,"Colorful hillside neighborhoods cascade down to the bustling port, where vibrant street art and ocean breezes create an inspiring, bohemian atmosphere.| Region: south_america|Budget: Mid-range"
442,Colmar,France,"Charming canals lined with half-timbered houses and vibrant flowers create a fairy-tale atmosphere, inviting leisurely strolls and delightful discoveries.| Region: europe|Budget: Mid-range"
443,Bratislava,Slovakia,"Charming cobblestone streets and lively squares invite you to explore colorful facades, historic landmarks, and cozy cafés offering a warm, welcoming vibe.| Region: europe|Budget: Mid-range"
444,Hong Kong,Hong Kong,"A bustling metropolis where neon lights reflect off harbor waters, offering a vibrant mix of street markets, towering skyscrapers, and serene parks.| Region: asia|Budget: Luxury"
445,Trinidad,Cuba,"Cobblestone streets echo with the sounds of salsa music, while colorful colonial buildings and vibrant markets create a lively, timeless atmosphere.| Region: north_america|Budget: Budget"
446,Plovdiv,Bulgaria,"Charming cobblestone streets, vibrant street art, and ancient ruins create a unique blend of history and modernity, inviting leisurely exploration.| Region: europe|Budget: Budget"
447,Maui,United States,"Lush landscapes, vibrant sunsets, and the gentle sound of ocean waves create an inviting and tranquil island atmosphere perfect for unwinding.| Region: oceania|Budget: Luxury"
448,Khiva,Uzbekistan,"Wander through ancient, sun-drenched streets surrounded by intricately carved minarets and walls, where history whispers from every corner and time feels suspended.| Region: asia|Budget: Budget"
449,Belize City,Belize,"A vibrant mix of Caribbean charm and colonial history, with bustling markets, colorful streets, and the gentle sound of the sea nearby.| Region: north_america|Budget: Mid-range"
450,Harare,Zimbabwe,"Vibrant streets filled with colorful markets, the scent of blooming jacarandas, and a lively atmosphere make every moment feel uniquely captivating.| Region: africa|Budget: Budget"
451,Ubud,Indonesia,"Lush rice terraces, serene temples, and a vibrant arts scene create a peaceful yet inspiring atmosphere perfect for rejuvenation and exploration.| Region: asia|Budget: Budget"
452,Punta del Este,Uruguay,"Golden beaches meet vibrant nightlife, creating a lively yet laid-back atmosphere where ocean breezes, art, and music fill the air.| Region: south_america|Budget: Mid-range"
453,Rapa Nui,Chile,"Mystical landscapes dotted with iconic stone statues create a serene yet awe-inspiring atmosphere, perfect for those seeking a unique cultural experience.| Region: south_america|Budget: Luxury"
454,Cork,Ireland,"Charming streets lined with colorful shops and lively pubs create a welcoming vibe, while the nearby coast offers stunning natural beauty.| Region: europe|Budget: Mid-range"
455,Batumi,Georgia,"A coastal city where lush green mountains meet the Black Sea, offering a blend of modern architecture and charming historic streets.| Region: asia|Budget: Budget"
456,Vladivostok,Russia,"Sweeping ocean views, bustling ports, and a mix of Russian and Asian influences create a dynamic and intriguing atmosphere.| Region: asia|Budget: Mid-range"
457,Murmansk,Russia,"Cold winds sweep across the Arctic landscape, where northern lights dance in the sky and the stark beauty of nature feels otherworldly.| Region: asia|Budget: Mid-range"
458,Moscow,Russia,"Grand architecture, vibrant streets, and a rich cultural tapestry create a dynamic atmosphere where history and modern life intertwine seamlessly.| Region: asia|Budget: Mid-range"
459,St Petersburg,Russia,"Grand palaces and winding canals create an enchanting atmosphere, where every corner reveals rich history and artistic treasures.| Region: asia|Budget: Mid-range"
460,Caye Caulker,Belize,"Charming sandy streets, vibrant Caribbean colors, and a laid-back vibe invite you to unwind and soak up the island''s easygoing atmosphere.| Region: north_america|Budget: Budget"
461,Fort Lauderdale,United States,"Palm-lined beaches and vibrant nightlife create an inviting atmosphere, where the gentle ocean breeze and warm sun make relaxation effortless.| Region: north_america|Budget: Mid-range"
462,Abu Dhabi,United Arab Emirates,"Modern skyscrapers meet serene desert landscapes, offering a blend of luxury and tradition with vibrant souks and stunning coastal views.| Region: middle_east|Budget: Luxury"
463,Casablanca,Morocco,"Vibrant markets, aromatic spices, and stunning architecture create an inviting atmosphere, blending modern energy with rich cultural heritage.| Region: africa|Budget: Budget"
464,Meknes,Morocco,Winding streets filled with the scent of spices and the sound of lively markets create a captivating and intimate experience.| Region: africa|Budget: Budget
465,Gold Coast,Australia,"Endless beaches and vibrant nightlife create a lively yet laid-back vibe, with surfers and sun-seekers enjoying the warm, golden sands.| Region: oceania|Budget: Mid-range"
466,Rarotonga,Cook Islands,"Lush green mountains meet crystal-clear lagoons, offering a tranquil escape where the gentle rhythm of island life captivates your senses.| Region: oceania|Budget: Mid-range"
467,Funafuti,Tuvalu,"Gentle sea breezes, vibrant sunsets, and the rhythmic sound of waves create a serene backdrop for a truly tranquil escape.| Region: oceania|Budget: Luxury"
468,Playa del Carmen,Mexico,"Sun-drenched beaches, vibrant nightlife, and a laid-back vibe create an inviting atmosphere perfect for both adventure and relaxation.| Region: north_america|Budget: Mid-range"
469,Sharm El Sheikh,Egypt,Crystal-clear waters and vibrant coral reefs invite you to explore a world of underwater wonders while sun-drenched beaches promise pure relaxation.| Region: africa|Budget: Mid-range
470,Ayers Rock,Australia,"The vast, red desert landscape offers a profound sense of solitude, with breathtaking sunsets and the spiritual aura of ancient rock formations.| Region: oceania|Budget: Luxury"
471,Moorea,French Polynesia,"Lush green mountains meet turquoise lagoons, creating a serene paradise where gentle ocean breezes and vibrant coral reefs invite endless exploration.| Region: oceania|Budget: Luxury"
472,Salzburg,Austria,"Charming cobblestone streets lead to stunning baroque architecture and cozy coffeehouses, creating a warm, inviting atmosphere that''s both historic and lively.| Region: europe|Budget: Mid-range"
473,Turin,Italy,"Strolling through elegant piazzas and baroque architecture, you''ll feel the city''s rich history and vibrant cultural scene come alive around you.| Region: europe|Budget: Mid-range"
474,Lugano,Switzerland,"Nestled by a serene lake and surrounded by lush mountains, this charming spot offers a delightful blend of Swiss and Italian cultures.| Region: europe|Budget: Luxury"
475,Goa,India,"Golden beaches stretch endlessly alongside vibrant markets and aromatic spice-scented air, offering a perfect blend of relaxation and lively culture.| Region: asia|Budget: Mid-range"
476,Islamabad,Pakistan,"Serene tree-lined streets, vibrant markets, and stunning views of the Margalla Hills offer a peaceful yet dynamic experience.| Region: asia|Budget: Mid-range"
477,Fortaleza,Brazil,"Golden beaches with rolling waves, bustling markets, and vibrant nightlife create an energetic blend of relaxation and excitement.| Region: south_america|Budget: Mid-range"
478,Antofagasta,Chile,"A coastal city where the desert meets the sea, offering dramatic landscapes, vibrant sunsets, and a unique blend of tranquility and adventure.| Region: south_america|Budget: Mid-range"
479,Bariloche,Argentina,Lakeside vistas and snow-capped mountains create a serene backdrop for outdoor adventures and cozy evenings in charming alpine-style lodges.| Region: south_america|Budget: Mid-range
480,Quebec City,Canada,"Cobblestone streets and historic architecture create a charming old-world atmosphere, with lively festivals and cozy bistros offering a warm, inviting experience.| Region: north_america|Budget: Mid-range"
481,Zion National Park,United States,"Towering red rock cliffs and serene hiking trails offer a breathtaking escape into nature, where every turn reveals a stunning new vista.| Region: north_america|Budget: Mid-range"
482,Espiritu Santo,Vanuatu,"Lush rainforests, crystal-clear waters, and vibrant coral reefs create an idyllic setting for adventure and relaxation on this tropical island.| Region: oceania|Budget: Mid-range"
483,Kota Kinabalu,Malaysia,"Lush rainforests meet vibrant city life, offering a blend of natural wonders and cultural richness that invites exploration and adventure.| Region: asia|Budget: Mid-range"
484,Lake Tahoe,United States,"Pristine blue waters surrounded by towering pines and mountains create a serene escape, perfect for both adventure and relaxation in nature''s embrace.| Region: north_america|Budget: Luxury"
485,Antalya,Turkey,"Sun-drenched beaches meet ancient ruins and bustling bazaars, offering a blend of relaxation and cultural exploration in a picturesque coastal setting.| Region: asia|Budget: Mid-range"
486,Cappadocia,Turkey,"Imagine drifting over surreal landscapes in a hot air balloon, where ancient rock formations and vibrant valleys create an otherworldly experience.| Region: asia|Budget: Mid-range"
487,Sidi Bou Said,Tunisia,"Whitewashed buildings with blue accents overlook the Mediterranean, offering a serene atmosphere filled with gentle sea breezes and vibrant local art.| Region: africa|Budget: Budget"
488,Tehran,Iran,"Bustling bazaars and serene parks coexist with historic palaces and modern art scenes, offering a rich tapestry of culture and hospitality.| Region: middle_east|Budget: Budget"
489,Byron Bay,Australia,"A laid-back coastal vibe with stunning beaches, vibrant markets, and lush hinterlands offering a perfect blend of relaxation and adventure.| Region: oceania|Budget: Mid-range"
490,Port Douglas,Australia,"Tropical breezes, lush rainforests, and the vibrant coral of the Great Barrier Reef create a serene paradise perfect for unwinding and adventure.| Region: oceania|Budget: Luxury"
491,Tahiti,French Polynesia,"Lush landscapes and tranquil lagoons invite a sense of serenity, where vibrant markets and local flavors add a touch of island warmth.| Region: oceania|Budget: Luxury"
492,Santa Cruz de la Sierra,Bolivia,"A bustling city with vibrant markets, lush parks, and a warm tropical climate that invites you to explore its lively streets and local flavors.| Region: south_america|Budget: Budget"
493,Montego Bay,Jamaica,"Golden beaches meet turquoise waters, creating a laid-back vibe where reggae rhythms and the scent of jerk spices fill the air.| Region: north_america|Budget: Mid-range"
494,Acapulco,Mexico,"Golden beaches meet vibrant nightlife, where the sound of crashing waves and lively music create an atmosphere that''s both thrilling and laid-back.| Region: north_america|Budget: Mid-range"
495,Manuel Antonio National Park,Costa Rica,"Lush rainforests meet sandy beaches under a vibrant sun, where playful monkeys and colorful birds create an enchanting, tropical experience.| Region: north_america|Budget: Mid-range"
496,Kuwait City,Kuwait,"A modern skyline meets traditional souks, where the aroma of spices and the warmth of the desert sun create an inviting atmosphere.| Region: middle_east|Budget: Luxury"
497,Uluru,Australia,"The vast, red desert landscape is both humbling and awe-inspiring, with sunsets casting a magical glow over the ancient rock formations.| Region: oceania|Budget: Luxury"
498,Lautoka,Fiji,"A vibrant port city where the aroma of sugarcane wafts through the air, blending with the lively sounds of bustling markets.| Region: oceania|Budget: Mid-range"
499,Nadi,Fiji,"Tropical breezes and vibrant markets greet you, where lush greenery meets sandy beaches, creating a laid-back yet lively atmosphere.| Region: oceania|Budget: Mid-range"
500,Lausanne,Switzerland,"Nestled by the lake, this city charms with its blend of historic architecture, vibrant cultural scene, and stunning alpine views.| Region: europe|Budget: Luxury"
501,Vilamoura,Portugal,"Sun-drenched marina views, vibrant nightlife, and golden beaches create a lively yet relaxed atmosphere perfect for unwinding and enjoying coastal charm.| Region: europe|Budget: Mid-range"
502,Cologne,Germany,"Charming cobblestone streets, the majestic cathedral, and lively beer halls create a welcoming atmosphere filled with history and vibrant local culture.| Region: europe|Budget: Mid-range"
503,Pisa,Italy,"Charming narrow streets open up to sunlit squares, with the aroma of fresh pasta and the sound of church bells filling the air.| Region: europe|Budget: Mid-range"
504,Kandy,Sri Lanka,"Lush hills, serene lakes, and the scent of temple incense create a tranquil atmosphere that''s both spiritually uplifting and visually stunning.| Region: asia|Budget: Budget"
505,Yangon,Myanmar,"Bustling streets filled with vibrant markets, golden pagodas glistening in the sun, and the warm smiles of locals create a welcoming energy.| Region: asia|Budget: Budget"
506,Lima,Peru,"A lively blend of colonial charm and vibrant modernity, with bustling markets, ocean views, and the tantalizing aroma of street food.| Region: south_america|Budget: Mid-range"
507,Iguazu Falls,Argentina,The thunderous roar of cascading water and the lush embrace of the surrounding rainforest create an awe-inspiring natural spectacle.| Region: south_america|Budget: Mid-range
508,Santa Marta,Colombia,"Golden beaches meet lush mountains, creating a laid-back vibe where you can savor fresh seafood and vibrant sunsets by the sea.| Region: south_america|Budget: Budget"
509,Cali,Colombia,"Lively streets filled with salsa rhythms, vibrant street art, and the aroma of empanadas create an infectious energy that''s hard to resist.| Region: south_america|Budget: Budget"
510,Cancun,Mexico,"Powdery white sand beaches, turquoise waters, and lively nightlife create a vibrant atmosphere perfect for both relaxation and adventure.| Region: north_america|Budget: Mid-range"
511,San Antonio,United States,Historic missions and lively riverside pathways invite you to wander through a city rich with cultural charm and Texan hospitality.| Region: north_america|Budget: Mid-range
512,Malaga,Spain,"Sun-drenched beaches, vibrant tapas bars, and historic architecture create a lively yet relaxed atmosphere that invites leisurely exploration and indulgence.| Region: europe|Budget: Mid-range"
513,Medellín,Colombia,"Lush green hills surround a vibrant city buzzing with music, art, and the warmth of its welcoming people, offering endless exploration.| Region: south_america|Budget: Mid-range"
514,Granada,Spain,"Winding cobblestone streets lead to vibrant plazas filled with the aromas of tapas, while the Alhambra''s majestic presence captivates with its historic allure.| Region: europe|Budget: Mid-range"
515,Linz,Austria,"A blend of historic charm and modern innovation, with riverside walks, vibrant arts scenes, and a welcoming atmosphere that invites exploration.| Region: europe|Budget: Mid-range"
