city_id,city_name,country,description
130,Port Louis,Mauritius,"A bustling port city where vibrant markets, colonial architecture, and the scent of street food create a lively and colorful atmosphere.| Region: africa|Budget: Mid-range"
131,Beira,Mozambique,Warm ocean breezes mix with the vibrant energy of local markets and the relaxed charm of coastal streets lined with casuarina trees.| Region: africa|Budget: Budget
132,Salalah,Oman,"Lush green landscapes meet the Arabian Sea, creating a serene atmosphere filled with the scent of frankincense and the sound of gentle waves.| Region: middle_east|Budget: Mid-range"
133,Pretoria,South Africa,"Wide tree-lined avenues and vibrant jacaranda blooms create a serene backdrop for exploring cultural landmarks and lively markets in a warm, welcoming atmosphere.| Region: africa|Budget: Mid-range"
134,Monterrey,Mexico,"Nestled between dramatic mountains, the city offers a vibrant blend of modern life and cultural richness, with lively streets and friendly locals.| Region: north_america|Budget: Mid-range"
135,Chisinau,Moldova,"Tree-lined streets and Soviet-era architecture mix with lively markets and cozy wine bars, offering a unique and welcoming vibe.| Region: europe|Budget: Budget"
136,Oslo,Norway,"Modern architecture meets stunning natural landscapes, with serene fjords and vibrant city life offering a unique blend of tranquility and excitement.| Region: europe|Budget: Luxury"
137,Paramaribo,Suriname,"Lush greenery, colonial architecture, and vibrant street markets create a lively atmosphere where tropical warmth meets cultural diversity.| Region: south_america|Budget: Budget"
138,Kotor,Montenegro,"Winding cobblestone streets and ancient stone walls create a charming, timeless atmosphere, inviting you to explore hidden corners and scenic views.| Region: europe|Budget: Mid-range"
139,Rabat,Morocco,"A city where historic medinas meet modern boulevards, offering a serene coastal vibe with the scent of sea air and spices.| Region: africa|Budget: Budget"
140,Arequipa,Peru,Charming colonial architecture and vibrant plazas set against a backdrop of volcanic peaks create a captivating blend of history and natural beauty.| Region: south_america|Budget: Budget
141,Krakow,Poland,"Charming cobblestone streets and lively squares invite exploration, while the rich history and vibrant culture create an inviting and warm atmosphere.| Region: europe|Budget: Mid-range"
142,Chiang Rai,Thailand,"Quiet temples and vibrant markets blend with lush green landscapes, offering a serene yet culturally rich experience for the curious traveler.| Region: asia|Budget: Budget"
143,Maastricht,Netherlands,"Cobblestone streets and medieval architecture create a charming atmosphere, while lively squares and riverside paths invite leisurely exploration and relaxation.| Region: europe|Budget: Mid-range"
144,Christchurch,New Zealand,"A city reborn with innovative architecture and lush gardens, offering a mix of urban charm and stunning natural landscapes.| Region: oceania|Budget: Mid-range"
145,Gotland,Sweden,"Charming cobblestone streets, medieval ruins, and serene coastal landscapes offer a peaceful escape with a touch of historical intrigue and natural beauty.| Region: europe|Budget: Mid-range"
146,St Ives,United Kingdom,"Charming cobblestone streets wind through art galleries and quaint shops, with the salty sea breeze adding a refreshing touch to your stroll.| Region: europe|Budget: Mid-range"
147,Tromsø,Norway,"Snow-draped landscapes and vibrant northern lights create a magical atmosphere, while the crisp Arctic air invigorates your senses and spirit.| Region: europe|Budget: Luxury"
148,Granada,Nicaragua,"Cobblestone streets lined with colorful colonial buildings and the distant scent of tropical fruits create a charming, laid-back atmosphere.| Region: north_america|Budget: Budget"
149,San Juan,Puerto Rico,"Cobblestone streets lined with colorful colonial buildings, lively salsa rhythms, and the scent of ocean breezes create a vibrant and welcoming atmosphere.| Region: north_america|Budget: Mid-range"
150,Salt Lake City,United States,"Surrounded by stunning mountains, this city offers a blend of vibrant urban life and serene natural beauty, perfect for outdoor enthusiasts.| Region: north_america|Budget: Mid-range"
151,Asunción,Paraguay,"Stroll through sun-dappled streets, where lively markets and the scent of grilled meats create a warm, inviting atmosphere.| Region: south_america|Budget: Budget"
152,Manila,Philippines,"Bustling streets filled with vibrant jeepneys and the aroma of street food create an exciting, sensory-rich experience that''s uniquely captivating.| Region: asia|Budget: Budget"
153,Bern,Switzerland,"Charming cobblestone streets wind through medieval architecture, while the gentle flow of the river creates a serene backdrop for leisurely exploration.| Region: europe|Budget: Luxury"
154,Catania,Italy,"Sun-soaked streets filled with the aroma of fresh seafood, lively markets, and the dramatic backdrop of a smoking volcano create a unique atmosphere.| Region: europe|Budget: Mid-range"
155,Davao,Philippines,"Lush landscapes meet urban vibrancy, with bustling markets, serene parks, and the scent of tropical fruits filling the air.| Region: asia|Budget: Budget"
156,Porto,Portugal,"Charming riverside streets, vibrant tiles, and the rich aroma of port wine create a warm and inviting atmosphere perfect for leisurely exploration.| Region: europe|Budget: Mid-range"
157,Azores,Portugal,"Lush volcanic landscapes, tranquil ocean vistas, and charming villages create a serene atmosphere perfect for unwinding and connecting with nature.| Region: europe|Budget: Mid-range"
158,Freetown,Sierra Leone,"Lively streets filled with vibrant markets, friendly locals, and the rhythmic sounds of the ocean create a welcoming and dynamic atmosphere.| Region: africa|Budget: Budget"
159,Laval,Quebec,"A blend of urban charm and natural beauty, with lush parks and vibrant cultural spots offering a refreshing escape from the city rush.| Region: north_america|Budget: Mid-range"
160,Saint-Denis,Réunion,"A lively mix of Creole culture, bustling markets, and lush mountain backdrops create a vibrant and welcoming atmosphere full of discovery.| Region: africa|Budget: Mid-range"
161,Constanta,Romania,"Golden beaches meet historic architecture, offering a blend of sun-soaked relaxation and the charm of ancient ruins and lively promenades.| Region: europe|Budget: Budget"
162,Puerto Vallarta,Mexico,"Golden beaches meet the lush Sierra Madre mountains, creating a vibrant yet laid-back atmosphere filled with colorful markets and lively nightlife.| Region: north_america|Budget: Mid-range"
163,Cape Town,South Africa,"A vibrant coastal city surrounded by rugged mountains and pristine beaches, offering laid-back afternoons, diverse cultures, and breathtaking views.| Region: africa|Budget: Mid-range"
164,Castries,Saint Lucia,"Colorful markets, ocean breezes, and lively street music create a vibrant atmosphere, inviting you to explore and unwind at your own pace.| Region: north_america|Budget: Mid-range"
165,São Tomé,São Tomé and Príncipe,"Lush rainforests, tranquil beaches, and the gentle rhythm of island life create a serene escape filled with natural beauty and warmth.| Region: africa|Budget: Mid-range"
166,Madrid,Spain,"Vibrant streets filled with lively tapas bars, stunning architecture, and a rich tapestry of history create an inviting and energetic atmosphere.| Region: europe|Budget: Mid-range"
167,Nantes,France,"A city where historic charm meets modern creativity, with cobblestone streets, vibrant art scenes, and the gentle flow of the Loire River.| Region: europe|Budget: Mid-range"
168,Victoria,Seychelles,"Lush tropical landscapes meet the vibrant colors of bustling markets, offering a sensory feast of exotic flavors and warm ocean breezes.| Region: africa|Budget: Luxury"
169,Ljubljana,Slovenia,"Charming cobblestone streets, vibrant riverfront cafés, and lush green spaces offer a welcoming atmosphere that''s both lively and relaxing.| Region: europe|Budget: Mid-range"
170,Chengdu,China,"A lively blend of spicy street food aromas, lush green parks, and the gentle charm of giant pandas creates an inviting, laid-back atmosphere.| Region: asia|Budget: Mid-range"
171,Menorca,Spain,"Golden beaches meet turquoise waters, offering a tranquil escape with gentle breezes, charming villages, and the scent of pine forests in the air.| Region: europe|Budget: Mid-range"
172,Stone Town,Tanzania,"Winding alleys filled with vibrant markets, the aroma of spices, and the sound of distant waves create an atmosphere both lively and enchanting.| Region: africa|Budget: Budget"
173,Johannesburg,South Africa,"A bustling urban landscape with vibrant street art, diverse culinary delights, and a palpable energy that captures the essence of modern African city life.| Region: africa|Budget: Mid-range"
174,Busan,South Korea,"Coastal breezes mix with the scent of street food, while vibrant markets and serene temples create a lively yet calming atmosphere.| Region: asia|Budget: Mid-range"
175,Koh Lanta,Thailand,"Golden beaches, gentle waves, and lush greenery create a serene escape where you can unwind and soak in the tranquil island vibe.| Region: asia|Budget: Budget"
176,Mumbai,India,"A bustling metropolis where vibrant street life, aromatic food stalls, and historic landmarks blend with a dynamic energy that never sleeps.| Region: asia|Budget: Mid-range"
177,Istanbul,Turkey,"A captivating blend of East and West, with vibrant bazaars, aromatic spices, historic mosques, and the serene Bosphorus weaving through daily life.| Region: europe|Budget: Mid-range"
178,Seville,Spain,"Sun-drenched plazas, the aroma of orange blossoms, and the passionate rhythm of flamenco create an enchanting and lively atmosphere.| Region: europe|Budget: Mid-range"
179,Bangkok,Thailand,Busy streets filled with vibrant markets and aromatic street food stalls create an exhilarating atmosphere that's both chaotic and captivating.| Region: asia|Budget: Budget
180,Belfast,United Kingdom,"Cozy pubs, historic streets, and the lively spirit of its people create an inviting and culturally rich atmosphere full of stories.| Region: europe|Budget: Mid-range"
181,Odessa,Ukraine,"Charming cobblestone streets, lively markets, and the gentle sea breeze create a relaxed yet vibrant atmosphere perfect for unwinding and exploring.| Region: europe|Budget: Budget"
182,Zanzibar Town,Tanzania,Winding streets filled with the aroma of spices and the sound of Swahili music create an enchanting and vibrant atmosphere.| Region: africa|Budget: Mid-range
183,Antananarivo,Madagascar,"Bustling streets filled with lively markets and the aroma of street food create an energetic vibe, surrounded by rolling hills and unique architecture.| Region: africa|Budget: Budget"
184,Krabi,Thailand,"Turquoise waters lap against limestone cliffs, while vibrant markets and serene beaches invite you to unwind and explore at your own pace.| Region: asia|Budget: Budget"
185,Lomé,Togo,"Bustling markets filled with vibrant textiles and the scent of spices create an energetic atmosphere, while palm-lined beaches offer serene escapes.| Region: africa|Budget: Budget"
186,Port of Spain,Trinidad and Tobago,"Bustling streets filled with lively music and vibrant colors offer a sensory feast, where Caribbean culture and urban energy intertwine seamlessly.| Region: north_america|Budget: Mid-range"
187,Muscat,Oman,"Golden desert landscapes meet the azure sea, creating a serene backdrop for exploring traditional souks, grand mosques, and coastal promenades.| Region: middle_east|Budget: Mid-range"
188,Kyiv,Ukraine,"Strolling through lively squares and historic streets, you''ll feel the vibrant energy of a city rich in culture and warm hospitality.| Region: europe|Budget: Budget"
189,Galle,Sri Lanka,"Charming cobblestone streets, colonial architecture, and the salty breeze of the ocean create a serene and timeless atmosphere.| Region: asia|Budget: Budget"
190,Gdansk,Poland,"Charming cobblestone streets and vibrant maritime history meet the salty breeze of the Baltic, creating a welcoming and lively coastal atmosphere.| Region: europe|Budget: Mid-range"
191,Miami,United States,"Vibrant streets pulsate with Latin beats, ocean breezes carry the scent of salt and sunscreen, and art deco architecture adds a nostalgic charm.| Region: north_america|Budget: Luxury"
192,Svalbard,Norway,"Vast, icy landscapes and the ethereal glow of the northern lights create a surreal, almost otherworldly experience, inviting deep reflection and awe.| Region: europe|Budget: Luxury"
193,Lapland,Finland,"Snow-draped landscapes, shimmering northern lights, and cozy log cabins create a magical atmosphere perfect for winter adventures and quiet reflection.| Region: europe|Budget: Luxury"
194,Tunis,Tunisia,"Wander through bustling souks and historic medinas, where the scent of spices and the call to prayer create an enchanting atmosphere.| Region: africa|Budget: Budget"
195,San Francisco,United States,"Fog-kissed hills, eclectic neighborhoods, and the scent of fresh sea air create an inviting and dynamic atmosphere that''s both laid-back and vibrant.| Region: north_america|Budget: Luxury"
196,Boston,United States,"Historic streets meet modern innovation, offering a mix of charming neighborhoods, rich history, and vibrant cultural scenes that invite exploration and discovery.| Region: north_america|Budget: Luxury"
197,Rotorua,New Zealand,"Steam rises from bubbling mud pools and the air is filled with the scent of sulfur, creating a unique geothermal wonderland.| Region: oceania|Budget: Mid-range"
198,El Chaltén,Argentina,"Nestled amidst rugged peaks and vast landscapes, this charming village offers a sense of tranquility and awe-inspiring natural beauty.| Region: south_america|Budget: Budget"
199,Christiansted,U.S. Virgin Islands,"Charming streets lined with pastel-hued buildings, ocean breezes carrying the scent of salt, and a laid-back Caribbean vibe invite relaxation.| Region: north_america|Budget: Mid-range"
200,Houston,United States,"A sprawling city where vibrant cultural districts, lively food scenes, and lush parks create a welcoming atmosphere full of discovery and warmth.| Region: north_america|Budget: Mid-range"
201,San Diego,United States,"Sun-drenched beaches, vibrant neighborhoods, and an easygoing vibe invite you to savor ocean breezes and explore diverse, lively cultural spots.| Region: north_america|Budget: Mid-range"
202,Ladakh,India,"Rugged landscapes with towering mountains and serene monasteries create a tranquil yet awe-inspiring atmosphere, perfect for those seeking adventure and peace.| Region: asia|Budget: Budget"
203,Chefchaouen,Morocco,"Wander through winding blue-washed alleys, breathe in the fresh mountain air, and feel a serene calm envelop you in this charming town.| Region: africa|Budget: Budget"
204,Lviv,Ukraine,"Cobblestone streets, charming coffeehouses, and a rich tapestry of history and culture create a warm and inviting atmosphere for exploration.| Region: europe|Budget: Budget"
205,Nashville,United States,"Lively streets filled with music and friendly faces, where the aroma of Southern cuisine mingles with the vibrant energy of live performances.| Region: north_america|Budget: Mid-range"
206,Cleveland,United States,"A city where industrial roots meet cultural renaissance, offering lively arts scenes, lakefront breezes, and a welcoming Midwestern charm.| Region: north_america|Budget: Mid-range"
207,Ronda,Spain,Dramatic cliffs and a historic stone bridge create a breathtaking backdrop for wandering cobblestone streets and savoring local wines in sunlit plazas.| Region: europe|Budget: Mid-range
208,London,United Kingdom,"Iconic landmarks, bustling markets, and a rich tapestry of culture create a vibrant atmosphere that feels both historic and ever-evolving.| Region: europe|Budget: Luxury"
209,Rochester,United States,"Charming and unhurried, with scenic river views, vibrant arts, and a welcoming community vibe that makes you feel right at home.| Region: north_america|Budget: Mid-range"
210,Namibia,Namibia,"Vast desert landscapes meet rugged coastlines, creating a sense of awe and solitude, while vibrant wildlife offers thrilling encounters in nature.| Region: africa|Budget: Mid-range"
211,Memphis,United States,"Blues music fills the air as you wander through lively streets, savoring the aroma of smoky barbecue and the warmth of Southern hospitality.| Region: north_america|Budget: Mid-range"
212,Ashgabat,Turkmenistan,"Marble-clad buildings rise against a backdrop of desert landscapes, offering a surreal blend of modernity and tradition with a touch of mystery.| Region: asia|Budget: Luxury"
213,Tulum,Mexico,"Pristine beaches with turquoise waters meet ancient ruins and vibrant jungle, creating an inviting blend of relaxation and adventure.| Region: north_america|Budget: Mid-range"
214,Honolulu,United States,"Golden beaches meet vibrant city life, where the scent of plumeria and the sounds of ukulele create a laid-back, tropical vibe.| Region: oceania|Budget: Luxury"
215,Tashkent,Uzbekistan,"Wide avenues lined with Soviet-era architecture meet vibrant bazaars, creating a unique blend of history and lively local culture.| Region: asia|Budget: Budget"
216,Yangshuo,China,Lush karst mountains and tranquil rivers create a serene backdrop for cycling through rice paddies and exploring vibrant local markets.| Region: asia|Budget: Budget
217,Kuala Lumpur,Malaysia,"Bustling streets filled with diverse aromas and vibrant markets create a lively atmosphere, blending modern skyscrapers with rich cultural heritage.| Region: asia|Budget: Mid-range"
218,Cornwall,United Kingdom,"Rugged coastlines, charming villages, and sweeping beaches offer a sense of tranquility and timeless beauty, perfect for unwinding and exploring.| Region: europe|Budget: Mid-range"
219,Dhaka,Bangladesh,"A whirlwind of vibrant street life, bustling markets, and a rich tapestry of history and culture, offering endless sensory experiences.| Region: asia|Budget: Budget"
220,Seattle,United States,"A city where misty mornings blend with vibrant markets and lush green spaces, offering a cozy yet dynamic urban experience.| Region: north_america|Budget: Luxury"
221,Bishkek,Kyrgyzstan,Wide boulevards lined with Soviet-era architecture and bustling bazaars create a unique blend of history and vibrant local life.| Region: asia|Budget: Budget
222,Siem Reap,Cambodia,"Ancient temples rise through the jungle mist, while bustling markets and vibrant street food create a lively, sensory-rich experience.| Region: asia|Budget: Budget"
223,Valdivia,Chile,"Riverside charm and lush green landscapes create a serene atmosphere, with the scent of fresh seafood and the sound of birdsong nearby.| Region: south_america|Budget: Mid-range"
224,Salta,Argentina,"Stunning mountain landscapes, vibrant local markets, and the warmth of traditional folklore create an inviting and colorful atmosphere.| Region: south_america|Budget: Mid-range"
225,Split,Croatia,Wander through ancient stone streets where the Adriatic breeze mingles with lively chatter and the scent of fresh seafood from bustling markets.| Region: europe|Budget: Mid-range
226,Galápagos Islands,Ecuador,"Pristine landscapes teeming with unique wildlife create an atmosphere of untouched beauty, where every moment feels like an intimate encounter with nature.| Region: south_america|Budget: Luxury"
227,Florence,Italy,"Cobblestone streets filled with art, the aroma of fresh espresso, and vibrant piazzas create a captivating blend of history and modern life.| Region: europe|Budget: Mid-range"
228,Philadelphia,United States,"Historic cobblestone streets meet a vibrant arts scene, with lively markets and diverse neighborhoods creating a welcoming and dynamic urban experience.| Region: north_america|Budget: Mid-range"
229,Bordeaux,France,"Strolling through sun-dappled streets, you''ll find stunning architecture, vibrant markets, and the rich aroma of freshly baked baguettes filling the air.| Region: europe|Budget: Mid-range"
230,Strasbourg,France,"Charming cobblestone streets lined with half-timbered houses, the aroma of freshly baked pastries, and the gentle flow of the canals create a fairy-tale ambiance.| Region: europe|Budget: Mid-range"
231,Palau,Palau,"Crystal-clear waters teeming with marine life, lush forests, and a serene atmosphere offer a tranquil escape for nature lovers and adventurers alike.| Region: oceania|Budget: Luxury"
232,St. George's,Grenada,"Colorful streets wind around a picturesque harbor, where the scent of spices mingles with the sea breeze, creating a vibrant, laid-back charm.| Region: north_america|Budget: Mid-range"
233,Debrecen,Hungary,"Tree-lined streets, charming squares, and a blend of old-world charm with modern vibrancy create a welcoming and relaxed atmosphere.| Region: europe|Budget: Budget"
234,Jaipur,India,"A tapestry of vibrant colors and bustling markets, where ancient forts and palaces echo the grandeur of a rich cultural heritage.| Region: asia|Budget: Budget"
235,Crete,Greece,"Sun-drenched beaches, ancient ruins, and vibrant local markets create a tapestry of experiences that feel both timeless and refreshingly alive.| Region: europe|Budget: Mid-range"
236,Baltimore,United States,"Historic cobblestone streets meet vibrant waterfronts, offering a lively mix of seafood aromas, street art, and a welcoming, laid-back vibe.| Region: north_america|Budget: Mid-range"
237,Madang,Papua New Guinea,"Tropical breezes, vibrant coral reefs, and lush rainforests create a serene paradise where nature and local culture warmly embrace visitors.| Region: oceania|Budget: Budget"
238,Taormina,Italy,"Dramatic coastal views, ancient ruins, and charming piazzas create a picturesque setting that invites leisurely exploration and indulgent moments.| Region: europe|Budget: Mid-range"
239,Takayama,Japan,"Charming wooden houses, serene streets, and the gentle flow of the river create a peaceful atmosphere perfect for unwinding and exploration.| Region: asia|Budget: Mid-range"
240,Phoenix,United States,"Desert landscapes meet urban sophistication, offering vibrant arts, diverse dining, and endless sunshine, making every visit feel like a warm embrace.| Region: north_america|Budget: Mid-range"
241,Blantyre,Malawi,"A city where bustling markets, friendly locals, and the aroma of street food create a vibrant and welcoming atmosphere.| Region: africa|Budget: Budget"
242,Caracas,Venezuela,"Vibrant streets filled with lively music and bustling markets, surrounded by lush mountains and offering a mix of urban and natural beauty.| Region: south_america|Budget: Budget"
243,Da Lat,Vietnam,"Misty mornings, lush pine forests, and vibrant markets create a serene escape with a refreshing blend of nature and local culture.| Region: asia|Budget: Budget"
244,New York City,United States,"Skyscrapers touch the sky as vibrant streets buzz with energy, offering a sensory overload of sights, sounds, and diverse cultures.| Region: north_america|Budget: Luxury"
245,Sapa,Vietnam,"Rolling green terraces and misty mountain vistas create a serene escape, where vibrant local cultures and tranquil landscapes embrace visitors warmly.| Region: asia|Budget: Budget"
246,Guadalajara,Mexico,"Colorful streets, lively mariachi music, and the rich aroma of street food create an inviting blend of tradition and modernity.| Region: north_america|Budget: Mid-range"
247,Anchorage,United States,"Surrounded by breathtaking mountains and vast wilderness, this city offers a refreshing blend of rugged adventure and cozy urban charm.| Region: north_america|Budget: Mid-range"
248,Bhutan,Bhutan,"Mist-shrouded mountains and vibrant monasteries offer a serene escape, where spiritual tranquility and breathtaking landscapes merge for an unforgettable experience.| Region: asia|Budget: Luxury"
249,Samarkand,Uzbekistan,"Ancient architecture glimmers under the sun, with vibrant bazaars and fragrant spices creating an intoxicating blend of history and culture.| Region: asia|Budget: Budget"
250,Wellington,New Zealand,"Charming harborside views, vibrant arts scene, and a cozy mix of urban buzz and nature create a welcoming, eclectic atmosphere.| Region: oceania|Budget: Mid-range"
251,Lahore,Pakistan,"Bustling streets alive with vibrant colors and the aroma of spices, offering a rich tapestry of history, culture, and warm hospitality.| Region: asia|Budget: Budget"
252,San Pedro de Atacama,Chile,"Endless desert vistas meet surreal landscapes, where clear night skies reveal a tapestry of stars, creating an otherworldly sense of tranquility and wonder.| Region: south_america|Budget: Mid-range"
253,Madeira,Portugal,"Lush landscapes meet dramatic cliffs, where ocean breezes carry the scent of flowers and adventure awaits around every winding path.| Region: europe|Budget: Mid-range"
254,Gjirokastër,Albania,"Winding cobblestone streets and stone-roofed houses create a timeless atmosphere, with echoes of history in every corner and stunning mountain views.| Region: europe|Budget: Budget"
255,Brisbane,Australia,"Sun-drenched streets and lush riverside parks create a laid-back vibe, with vibrant markets and buzzing eateries adding a lively local flavor.| Region: oceania|Budget: Mid-range"
256,Cesky Krumlov,Czech Republic,"Winding cobblestone streets, charming medieval architecture, and the gentle flow of the Vltava River create a fairy-tale atmosphere you''ll never forget.| Region: europe|Budget: Mid-range"
257,Basseterre,Saint Kitts and Nevis,"Lush landscapes and vibrant markets create a lively yet laid-back atmosphere, where the rhythm of island life feels both invigorating and soothing.| Region: north_america|Budget: Mid-range"
